,tweet_source,tweet_text,tweet_date,tweet_vader_score,tweet_pos_score,tweet_neu_score,tweet_neg_score
271,CBS News,"Stephen Hillenburg, the creator of the beloved show ""Spongebob Squarepants,"" has gone to the great pineapple in the… https://t.co/ttQ4LCdKAy",Tue Nov 27 23:09:45 +0000 2018,0.8126,0.303,0.697,0.0
272,CBS News,NASA's Insight spacecraft sent us earthlings a selfie from Mars after landing there https://t.co/xiLWYG7Ph4,Tue Nov 27 22:50:00 +0000 2018,0.0,0.0,1.0,0.0
273,CBS News,Three doctors are being investigated for euthanizing a woman with autism https://t.co/juQcweLwaE https://t.co/dHRmGInsk8,Tue Nov 27 22:30:00 +0000 2018,0.0,0.0,1.0,0.0
274,CBS News,RT @CBSMoneyWatch: Is Tesla's Elon Musk in saying you have to work crazy hours to change the world? https://t.co/60vqXPEbtE,Tue Nov 27 21:52:08 +0000 2018,-0.34,0.0,0.882,0.118
275,CBS News,"President Trump threatens to end federal subsidies for GM after it announces layoffs and plant closings: ""I am here… https://t.co/F2gC3C9QwP",Tue Nov 27 21:29:54 +0000 2018,-0.3818,0.0,0.88,0.12
276,CBS News,CUO-NO: New York Gov. Andrew Cuomo says he's ruling out running for president in 2020 https://t.co/nCg4veJef2 https://t.co/dWrIA8bjj7,Tue Nov 27 21:09:36 +0000 2018,0.0,0.0,1.0,0.0
277,CBS News,"Elon Musk says people ""must work at least 80 hours a week to make a difference."" But research shows long workweeks… https://t.co/a7kI3hpY3U",Tue Nov 27 20:49:15 +0000 2018,0.0,0.0,1.0,0.0
278,CBS News,TERRIFYING: Tourist clings for life while dangling from a flying hang glider in Switzerland after his harness wasn'… https://t.co/E7zQjORwwe,Tue Nov 27 20:31:28 +0000 2018,-0.6633,0.0,0.793,0.207
279,CBS News,"Migrant mother falls off border fence, impaled in front of her two young children https://t.co/Fo24QK919S https://t.co/N3ZNXwPm0j",Tue Nov 27 20:10:34 +0000 2018,0.0,0.0,1.0,0.0
280,The New York Times,"More than half of all female homicide victims last year were killed by intimate partners or relatives, according to… https://t.co/JB6ne8yDb0",Wed Nov 28 01:00:04 +0000 2018,-0.7783,0.0,0.726,0.274
281,The New York Times,Who will win the Mississippi Senate runoff election? Keep this page open for live results when they come in. https://t.co/q360923jvF,Wed Nov 28 00:47:05 +0000 2018,0.5859,0.167,0.833,0.0
282,The New York Times,Democrats have united behind a bid to derail the district court nomination of a judge who defended a racially gerry… https://t.co/Mto34nQ2NH,Wed Nov 28 00:32:02 +0000 2018,0.1531,0.133,0.762,0.105
283,The New York Times,RT @nytopinion: Three not-so-crazy (but still crazy) theories about why Paul Manafort lied to Mueller. https://t.co/QcO14EhHwO,Wed Nov 28 00:17:03 +0000 2018,-0.3818,0.0,0.852,0.148
284,The New York Times,"Speculators are picking up the right to drill on enormous stretches of public land, and at bargain prices. ""The ind… https://t.co/nADYVf9GjT",Wed Nov 28 00:02:04 +0000 2018,0.2023,0.083,0.917,0.0
285,The New York Times,Evening Briefing: Here's what you need to know at the end of the day https://t.co/UJMVQUpe3U,Tue Nov 27 23:47:01 +0000 2018,0.0,0.0,1.0,0.0
286,The New York Times,"Juul is developing a pod that is higher in vapor, which, experts say, can enhance the rate at which nicotine is abs… https://t.co/QCniXOl1CM",Tue Nov 27 23:32:03 +0000 2018,0.0,0.0,1.0,0.0
287,The New York Times,"RT @nytclimate: In @NYTmag : ""The windshield phenomenon."" Your car is cleaner than it used to be after driving on the highway, and that's a…",Tue Nov 27 23:17:02 +0000 2018,0.1779,0.069,0.931,0.0
288,The New York Times,President Trump — irate over the G.M. cutbacks — threatened an end to federal tax credits that have helped underwri… https://t.co/JvnQPb0UFF,Tue Nov 27 22:47:05 +0000 2018,-0.6597,0.098,0.63,0.272
289,The New York Times,France's decision to return some looted African treasures increases pressure on European museums to return objects… https://t.co/VfDX1lDG0f,Tue Nov 27 22:32:05 +0000 2018,0.1531,0.14,0.75,0.11
290,The New York Times,Officials from 9 countries criticized Facebook at a hearing on Tuesday. They left an empty chair for Mark Zuckerber… https://t.co/KvW7EeL8xc,Tue Nov 27 22:18:06 +0000 2018,-0.5106,0.0,0.788,0.212
291,The New York Times,"RT @DLeonhardt: Three weeks ago, 62% of Missourians voted for a constitutional amendment to reduce corruption and make the state's election…",Tue Nov 27 22:10:05 +0000 2018,0.0,0.0,1.0,0.0
292,The New York Times,"In France this simple, nutritious soup is made with wild greens that you might forage on an afternoon’s walk, such… https://t.co/eYDT1r4y94",Tue Nov 27 21:55:05 +0000 2018,0.0,0.0,1.0,0.0
293,The New York Times,A roughly one-year-old mountain lion known as P-74 who was being tracked in the Santa Monica Mountains likely died… https://t.co/WeHrhqk6bk,Tue Nov 27 21:40:08 +0000 2018,0.0,0.0,1.0,0.0
294,The New York Times,RT @caitlinroper: The @nytimes for Kids brings you... NYC Kids' street style!! https://t.co/ZxPYvWZcJW,Tue Nov 27 21:32:04 +0000 2018,0.0,0.0,1.0,0.0
295,The New York Times,"In 1997, high school sophomore Esequiel Hernandez Jr. was shot and killed by a Marine on the border as he herded hi… https://t.co/RpFZyUBsLM",Tue Nov 27 21:25:05 +0000 2018,-0.6705,0.0,0.824,0.176
296,The New York Times,"Going bowling, a drumline, the fusion dance and more: here's how the NFL has been celebrating this season https://t.co/UD8MEqib42",Tue Nov 27 21:10:04 +0000 2018,0.5719,0.179,0.821,0.0
297,The New York Times,RT @nytimesbusiness: Stocks have had a bad month. Apple has had a worse one. https://t.co/7wmTFKkwFU,Tue Nov 27 20:45:07 +0000 2018,-0.765,0.0,0.625,0.375
298,The New York Times,"First, SpongeBob conquered TV screens. Then he starred in 2 films (with a 3rd film scheduled to be released in 2020… https://t.co/y3HquIexZR",Tue Nov 27 20:39:55 +0000 2018,0.0,0.0,1.0,0.0
299,The New York Times,A 26-year-old Guatemalan woman fell and was impaled on metal bars after she and her 2 children tried to climb a bor… https://t.co/YWYcoBd14q,Tue Nov 27 20:30:05 +0000 2018,0.0,0.0,1.0,0.0
300,Fox News,"Devotees lit earthen lamps in Ayodhya, India as part of Diwali celebrations, also known as a festival of lights, on… https://t.co/uWGZnrkvqD",Thu Nov 08 07:51:00 +0000 2018,0.5719,0.207,0.793,0.0
301,Fox News,".@TGowdySC on Jeff Sessions resigning: ""It was going to happen...He's been a proverbial dead man walking for severa… https://t.co/ojKL4KMFTz",Thu Nov 08 07:41:00 +0000 2018,-0.7351,0.0,0.721,0.279
302,Fox News,Mob chants threats outside @TuckerCarlson’s DC home https://t.co/IJE8m5gjWi,Thu Nov 08 07:31:00 +0000 2018,-0.4215,0.0,0.714,0.286
303,Fox News,".@TuckerCarlson: ""Supporting marriage and children is the best, maybe the only way, for Republicans or any of us to… https://t.co/fqPwC8XTaY",Thu Nov 08 07:21:00 +0000 2018,0.7964,0.283,0.717,0.0
304,Fox News,.@KennedyNation: Dems in 2020 better without Nancy https://t.co/54vTCiffG4,Thu Nov 08 07:16:00 +0000 2018,0.4404,0.293,0.707,0.0
305,Fox News,Battleground-state Dems who opposed Kavanaugh all defeated https://t.co/guqMSVjd74,Thu Nov 08 07:11:00 +0000 2018,-0.4767,0.0,0.693,0.307
306,Fox News,".@Jim_Jordan on his run for House GOP leader: “We have to match [@POTUS’s] intensity, that’s what I want to do. If… https://t.co/2VOW1ykCsI",Thu Nov 08 07:01:00 +0000 2018,0.0772,0.061,0.939,0.0
307,Fox News,.@senatemajldr: Dem Votes Against Kavanaugh Were a 'Godsend' to GOP in Midterms https://t.co/ietr8sP4EQ,Thu Nov 08 06:51:00 +0000 2018,0.0,0.0,1.0,0.0
308,Fox News,.@marcthiessen: “There’s lots of things that Democrats could take a stand on that they find inherently unacceptable… https://t.co/c7UFDzFd60,Thu Nov 08 06:41:00 +0000 2018,0.0,0.0,1.0,0.0
309,Fox News,".@DarrellIssa on the Mueller probe: ""Two years is a long time to look for a crime you can't prove.""… https://t.co/plX9kxpSXy",Thu Nov 08 06:36:00 +0000 2018,-0.5423,0.0,0.829,0.171
310,Fox News,"Second teen dies of gunshot wound after Oklahoma mom's rampage, authorities say https://t.co/VUQxsa3mq3",Thu Nov 08 06:31:00 +0000 2018,0.0,0.0,1.0,0.0
311,Fox News,.@marcthiessen: “The president today made very clear that he wants to cut deals with the Democrats. And quite frank… https://t.co/MGVdJQVfUt,Thu Nov 08 06:21:00 +0000 2018,0.2006,0.126,0.783,0.091
312,Fox News,"Florida Highway Patrol cruiser hits 142 mph in pursuit, catches on fire https://t.co/GqWKI45AAm",Thu Nov 08 06:11:00 +0000 2018,-0.34,0.0,0.833,0.167
313,Fox News,Democratic strategist @LeslieMarshall: “What we need is not a wall — and not a wall that we can’t afford — but comp… https://t.co/TzRWVJQeVv,Thu Nov 08 06:01:00 +0000 2018,0.0,0.0,1.0,0.0
314,Fox News,"Sex offender gets 22 years after missing boy, 14, found in his room at halfway house, authorities say https://t.co/sDd0VQzob4",Thu Nov 08 05:51:00 +0000 2018,-0.5719,0.0,0.783,0.217
315,Fox News,".@POTUS touts Senate gains, @LelandVittert breaks down the results @foxnewsnight https://t.co/VMzif8sgHH",Thu Nov 08 05:41:00 +0000 2018,0.3182,0.192,0.72,0.088
316,Fox News,Former Kavanaugh colleague among group being considered to replace Sessions as AG: reports https://t.co/HxAlDZx2Mg,Thu Nov 08 05:31:00 +0000 2018,0.0,0.0,1.0,0.0
317,Fox News,"Too close to call: Meticulous vote count transpiring in Arizona Senate race, @aacuna1 reports @foxnewsnight https://t.co/DV6EX4Ogxe",Thu Nov 08 05:26:00 +0000 2018,0.0,0.0,1.0,0.0
318,Fox News,"Former SEAL Mocked by 'SNL' Wins TX House Seat, Calls for More Vets in Congress https://t.co/T0PAhopphH… https://t.co/qhS5BVOE2U",Thu Nov 08 05:21:01 +0000 2018,0.6841,0.298,0.603,0.099
319,Fox News,South Carolina voter told to remove 'Trump' shirt in order to vote: report https://t.co/xWY2EdSpDF,Thu Nov 08 05:11:00 +0000 2018,0.0,0.0,1.0,0.0
320,CNN,This is how tear gas affects children https://t.co/aPw1BeeJ1q https://t.co/0DkocTliTY,Tue Nov 27 22:42:02 +0000 2018,0.0,0.0,1.0,0.0
321,CNN,"Journalist Wendy Fry, who reported from the border when US authorities deployed tear gas against migrants rushing t… https://t.co/T4M8MM5trS",Tue Nov 27 22:32:44 +0000 2018,0.0,0.0,1.0,0.0
322,CNN,A top House Republican President Donald Trump remains firm on requesting $5 billion for border security as part of… https://t.co/LdCDziZu1i,Tue Nov 27 22:20:06 +0000 2018,0.4939,0.198,0.802,0.0
323,CNN,White House national security adviser John Bolton says he didn't listen to a tape that captured part of the killing… https://t.co/Ro7gefxFmf,Tue Nov 27 22:10:03 +0000 2018,0.34,0.112,0.888,0.0
324,CNN,"PwC Chairman Tim Ryan: ""I would love to be remembered as somebody who led a moment that had America's workplaces be… https://t.co/w0Hf2KPHsq",Tue Nov 27 22:00:20 +0000 2018,0.6369,0.174,0.826,0.0
325,CNN,Draft court filings from Robert Mueller show what special counsel may know about Roger Stone's efforts to get infor… https://t.co/tcNOAP4WsD,Tue Nov 27 21:50:04 +0000 2018,0.4019,0.124,0.876,0.0
326,CNN,"The gunman in the mass shooting at a bar in Thousand Oaks, California, entered the building and opened fire, tossed… https://t.co/7Z9asPIHuq",Tue Nov 27 21:40:09 +0000 2018,-0.34,0.0,0.888,0.112
327,CNN,This is what a bunch of regional sports networks would do for Amazon https://t.co/f0omBN8VyS https://t.co/5ltvSqUbEB,Tue Nov 27 21:32:04 +0000 2018,0.1779,0.116,0.884,0.0
328,CNN,"Facebook has a ""black people problem,"" according to a former manager at the company. ""In some buildings, there are… https://t.co/2vDFSJYtcL",Tue Nov 27 21:21:05 +0000 2018,0.0,0.0,1.0,0.0
329,CNN,A Texas cotton farmer is battling cancer and couldn't harvest his crop. So his neighbors did it for him… https://t.co/8nWmyfbUz4,Tue Nov 27 21:10:05 +0000 2018,-0.7579,0.0,0.723,0.277
330,CNN,"Robert De Niro confirms split from wife Grace Hightower
https://t.co/yGke2Zlypy https://t.co/dFPdJACpaZ",Tue Nov 27 21:00:08 +0000 2018,0.4215,0.219,0.781,0.0
331,CNN,Vendors in this Chinese market can build a smartphone from scratch in a couple of hours https://t.co/qJRzy0upbB https://t.co/HJfACVrc79,Tue Nov 27 21:00:01 +0000 2018,0.0,0.0,1.0,0.0
332,CNN,"Stephen Hillenburg, the creator of ""SpongeBob Squarepants,"" has died. He was 57. https://t.co/aA8dieIqSX https://t.co/7a7bh6Sdeq",Tue Nov 27 20:51:25 +0000 2018,-0.5574,0.0,0.783,0.217
333,CNN,Mexico's president will bestow his nation's highest honor for foreigners on Jared Kushner on Friday in Buenos Aires… https://t.co/lfnsNIviOv,Tue Nov 27 20:44:02 +0000 2018,0.4939,0.151,0.849,0.0
334,CNN,"""The scientists have told us—despite Trump's absurd thought that this is a hoax—that the future of the planet is at… https://t.co/4mUZId9H9a",Tue Nov 27 20:31:07 +0000 2018,0.0,0.0,1.0,0.0
335,CNN,What's next for NASA's Mars InSight lander? https://t.co/Xngcj9C0U3 https://t.co/Y0unPeCa9o,Tue Nov 27 20:16:06 +0000 2018,0.0,0.0,1.0,0.0
336,CNN,President Trump threatened to cut all General Motors subsidies after the automaker announced thousands of jobs cuts… https://t.co/qh7d93JvwS,Tue Nov 27 20:04:07 +0000 2018,-0.6249,0.0,0.758,0.242
337,CNN,A woman was jailed for 3 months because police thought her cotton candy was meth https://t.co/Wca94JPlcW https://t.co/D9zbC5NXre,Tue Nov 27 19:52:07 +0000 2018,-0.4939,0.0,0.814,0.186
338,CNN,"Former FBI Director James Comey says Attorney General Matthew Whitaker ""may not be the sharpest knife in our drawer… https://t.co/oPXOoHOF1L",Tue Nov 27 19:40:09 +0000 2018,0.0,0.0,1.0,0.0
339,CNN,"Melania Trump's White House holiday decorations highlight ""patriotism'"" https://t.co/dnt63ixYFv https://t.co/EMLllMWLi8",Tue Nov 27 19:28:05 +0000 2018,0.6249,0.389,0.611,0.0
340,BBC News (World),Oprah Winfrey pays tribute to late mother Vernita Lee https://t.co/mWhU0UhwLv,Tue Nov 27 10:51:23 +0000 2018,0.0,0.0,1.0,0.0
341,BBC News (World),Lu Guang: Award-winning Chinese photographer disappears in Xinjiang https://t.co/y4CuCcR1AU,Tue Nov 27 10:24:45 +0000 2018,-0.34,0.0,0.769,0.231
342,BBC News (World),RT @BBCNews: New Zealand whale stranding: 'I will never forget their cries' https://t.co/O5kskASUj8,Tue Nov 27 09:50:32 +0000 2018,0.4449,0.263,0.737,0.0
343,BBC News (World),New Zealand whale stranding: 'I will never forget their cries' https://t.co/AQfrUSBlkV,Tue Nov 27 09:20:32 +0000 2018,0.4449,0.304,0.696,0.0
344,BBC News (World),"RT @BBCNews: Meet Mike - the magpie that says, ""Merry Christmas!"" 🎁🎄🎅

[Tap to expand] https://t.co/P2pQfaLgRu https://t.co/zXpJ5haf0n",Tue Nov 27 08:57:54 +0000 2018,0.5848,0.202,0.798,0.0
345,BBC News (World),"RT @BBCNews: Nasa lands InSight robot on #Mars to study planet's interior

https://t.co/hxpBD83WIT https://t.co/IrEcuCWDDh",Tue Nov 27 08:32:40 +0000 2018,0.0,0.0,1.0,0.0
346,BBC News (World),RT @BBCBenThompson: As President Trump weighs in on #Brexit and threatens more tariffs on #China imports - today we're asking - does the wo…,Tue Nov 27 08:27:32 +0000 2018,-0.3818,0.0,0.89,0.11
347,BBC News (World),China defends holding fugitive businessman's US children https://t.co/zb252iwf5y,Tue Nov 27 07:54:32 +0000 2018,0.0,0.0,1.0,0.0
348,BBC News (World),RT @BBCNews: The agony over an American dream https://t.co/ic9fa8wh8n,Tue Nov 27 07:53:21 +0000 2018,-0.2023,0.169,0.593,0.237
349,BBC News (World),John Allen Chau: India 'puts on hold' efforts to retrieve body https://t.co/yEkz1eWMAq,Tue Nov 27 07:53:15 +0000 2018,0.0,0.0,1.0,0.0
350,BBC News (World),"RT @BBCNews: Donald Trump suggests Theresa May's #Brexit agreement could impact UK-US trade deal

[Tap to expand]

https://t.co/mxCVFjIbFb…",Tue Nov 27 07:52:28 +0000 2018,0.4939,0.158,0.842,0.0
351,BBC News (World),RT @BBCNews: How cooking and cleaning transformed a violent man https://t.co/EveoOTcw0l,Tue Nov 27 07:50:49 +0000 2018,-0.5994,0.0,0.698,0.302
352,BBC News (World),RT @BBCNews: Brexit: Trump hints May's Brexit could bar UK-US trade deal https://t.co/Av39Iyzn7A,Tue Nov 27 07:50:44 +0000 2018,0.0,0.0,1.0,0.0
353,BBC News (World),"RT @davidshukmanbbc: British, French, German and American technology starting first full day on #Mars today #MarsInSight #MarsLanding ⁦@BBC…",Tue Nov 27 07:49:58 +0000 2018,0.0,0.0,1.0,0.0
354,BBC News (World),"RT @BBCBreaking: British academic Matthew Hedges praises ""brave and strong"" wife Daniela as he arrives back in UK after being pardoned by U…",Tue Nov 27 07:43:51 +0000 2018,0.9001,0.387,0.613,0.0
355,BBC News (World),"RT @BBCBreaking: Matthew Hedges, British academic jailed for spying in UAE, arrives home in UK after being pardoned https://t.co/DYR8Ux0c2G",Tue Nov 27 07:28:29 +0000 2018,-0.3182,0.086,0.769,0.145
356,BBC News (World),The man who spent decades befriending isolated Sentinelese tribe https://t.co/07MrKp8MfF,Tue Nov 27 07:21:46 +0000 2018,-0.3182,0.0,0.796,0.204
357,BBC News (World),"The families of Jumadil and Fikri were the lucky ones.

Hundreds of others lost their loved ones in the 2018 #Palu… https://t.co/VFsZGeT3rP",Tue Nov 27 05:42:18 +0000 2018,0.6597,0.239,0.679,0.082
358,BBC News (World),"The family’s happy ending, which was also captured on film.

[Tap to expand]

https://t.co/zQBqYtwIDK https://t.co/jOoW9soAfo",Tue Nov 27 05:42:12 +0000 2018,0.5719,0.209,0.791,0.0
359,BBC News (World),"The family banded together to search for Fikri.

A miracle arrived in the form of a social worker, who knocked at t… https://t.co/iz9OUo8W13",Tue Nov 27 05:39:59 +0000 2018,0.5859,0.16,0.84,0.0
360,CBS News,Diverse freshman class will bolster record number of Latinos in Congress https://t.co/92T6h5hv37 https://t.co/pCV3nm0XOc,Tue Nov 27 19:50:52 +0000 2018,0.0772,0.098,0.902,0.0
361,CBS News,"Sarah Huckabee Sanders on tear gas being used on migrants at the border: ""Certainly no one wants women or children… https://t.co/QCwcWsAQFw",Tue Nov 27 19:13:14 +0000 2018,0.0516,0.102,0.805,0.093
362,CBS News,Sen. Lindsey Graham urges Alexandria Ocasio-Cortez to visit the U.S. Holocaust Memorial Museum after she compared C… https://t.co/Lx1e8fSMtC,Tue Nov 27 19:11:00 +0000 2018,0.0,0.0,1.0,0.0
363,CBS News,"Sarah Huckabee Sanders says President Trump has ""no intent to do anything"" about Robert Mueller's investigation, de… https://t.co/Tq1t4E6zIp",Tue Nov 27 19:10:46 +0000 2018,-0.296,0.0,0.885,0.115
364,CBS News,National Security Advisor John Bolton says he hasn't listened to the tape of Jamal Khashoggi's killing because it's… https://t.co/ugOt0n8KpN,Tue Nov 27 19:08:02 +0000 2018,-0.4588,0.101,0.714,0.185
365,CBS News,"Top White House economic advisor Larry Kudlow says the Trump administration is looking into ""certain subsidies rega… https://t.co/aVUhDD6TQF",Tue Nov 27 18:52:16 +0000 2018,0.4404,0.196,0.804,0.0
366,CBS News,"""A different world"": Colorblind sheriff's deputy sees color for the first time thanks to colleagues' gift… https://t.co/6is1O6ITX5",Tue Nov 27 18:50:31 +0000 2018,0.4404,0.153,0.847,0.0
367,CBS News,WATCH LIVE: Sarah Huckabee Sanders holds first White House press briefing in a month amid conflicts over border sec… https://t.co/8QBRag96OQ,Tue Nov 27 18:36:43 +0000 2018,-0.3818,0.0,0.874,0.126
368,CBS News,"""Spongebob Squarepants"" creator Stephen Hillenburg dead at 57 https://t.co/6eMbJDVsiS https://t.co/olhzaaEexI",Tue Nov 27 18:30:44 +0000 2018,-0.6486,0.0,0.677,0.323
369,CBS News,Group urges authorities in India to abandon efforts to recover American's body on remote island… https://t.co/3WzIusDOEn,Tue Nov 27 18:10:36 +0000 2018,-0.4404,0.0,0.838,0.162
370,CBS News,Employee shot dead in Pennsylvania municipal building https://t.co/UtDYPjghxM https://t.co/TH9qRi5rpH,Tue Nov 27 17:50:39 +0000 2018,-0.6486,0.0,0.65,0.35
371,CBS News,Pelosi tries to win over Democrats ahead of House speaker vote https://t.co/Bjc4Vu6Pls https://t.co/ldVSewKwz9,Tue Nov 27 17:30:30 +0000 2018,0.5859,0.241,0.759,0.0
372,CBS News,Dad who lived in North Carolina church loses bid to avoid deportation https://t.co/juiTgyQkdx https://t.co/BlUsVanxTO,Tue Nov 27 17:10:44 +0000 2018,-0.5423,0.0,0.727,0.273
373,CBS News,"Facebook engineer warned in 2014 of Russian intrusion, U.K. lawmaker says https://t.co/SROv6ZOgUu https://t.co/C6k83z2G4V",Tue Nov 27 16:40:51 +0000 2018,-0.2732,0.0,0.851,0.149
374,CBS News,"Amazon says Cyber Monday, Black Friday broke sales records https://t.co/LPxowQJWnY https://t.co/v55TnWctyP",Tue Nov 27 16:20:47 +0000 2018,-0.2732,0.126,0.667,0.207
375,CBS News,Roger Stone associate Jerome Corsi says he is rejecting Robert Mueller plea deal https://t.co/QVptRDeMwy https://t.co/uEYulyQU7V,Tue Nov 27 16:00:55 +0000 2018,-0.4588,0.0,0.824,0.176
376,CBS News,A United Nations study out this week finds domestic violence is one of the most common killers of women around the… https://t.co/BaHjaZzxN2,Tue Nov 27 15:40:43 +0000 2018,-0.7832,0.095,0.611,0.294
377,CBS News,"If you don't know where your romaine came from, don't eat it, says CDC https://t.co/MTqD9AXS8U https://t.co/tvCrNfOKrn",Tue Nov 27 15:20:52 +0000 2018,0.0,0.0,1.0,0.0
378,CBS News,Russia released video of a group of captured Ukrainian sailors giving oral confessions to deliberately violating Ru… https://t.co/vrs82g4LIi,Tue Nov 27 15:00:47 +0000 2018,-0.2732,0.115,0.718,0.167
379,CBS News,President Trump says he expects to raise tariffs on China https://t.co/BwfCKB7aRn https://t.co/u78quW8dhH,Tue Nov 27 14:40:47 +0000 2018,0.0,0.0,1.0,0.0
380,The New York Times,"Lars von Trier's director's cut of ""The House That Jack Built"" prompted walkouts at the Cannes Film Festival over i… https://t.co/7H9RE4V6d9",Tue Nov 27 20:10:05 +0000 2018,0.1027,0.128,0.72,0.152
381,The New York Times,"Stephen Hillenburg, the former marine biology teacher who created “SpongeBob SquarePants,” died on Monday. He was 5… https://t.co/6x0Ifrls0m",Tue Nov 27 19:55:07 +0000 2018,-0.3818,0.093,0.741,0.167
382,The New York Times,The insect apocalypse is here. What does it mean for the rest of life on Earth? https://t.co/0KMQbNxeID,Tue Nov 27 19:40:08 +0000 2018,0.0,0.0,1.0,0.0
383,The New York Times,"Alone on a freezing cold mountaintop in Gansu, China across the world from a life she left behind almost a year ago… https://t.co/2MMiWZDEPQ",Tue Nov 27 19:25:05 +0000 2018,-0.34,0.0,0.841,0.159
384,The New York Times,Fox News viewers are fiercely loyal to their network. But will they pay $5.99 a month for on-demand access? https://t.co/0YIHEdKRlj,Tue Nov 27 19:10:04 +0000 2018,0.4019,0.144,0.791,0.065
385,The New York Times,"RT @SherylNYT: “I don’t agree with, ‘When they go low, we go low,’ but I do agree that when they go low, we have to respond,” @SenAmyKlobuc…",Tue Nov 27 19:00:15 +0000 2018,0.2023,0.16,0.705,0.135
386,The New York Times,Breaking News: Lion Air black box data shows a fatal tug of war between man and machine as pilots fought to regain… https://t.co/mguLouZApc,Tue Nov 27 18:53:46 +0000 2018,-0.8658,0.0,0.662,0.338
387,The New York Times,"The Bank of England plans to introduce a new £50 note, with the design honoring a scientist. One of the nominees? M… https://t.co/uPp5ZzD21g",Tue Nov 27 18:45:05 +0000 2018,0.5106,0.142,0.858,0.0
388,The New York Times,A judicial nominee nearing a showdown vote in the Senate Judiciary Committee could be the test for Senator Jeff Fla… https://t.co/B9V0y8isSy,Tue Nov 27 18:30:04 +0000 2018,0.0,0.0,1.0,0.0
389,The New York Times,RT @alanblinder: It's Election Day (again) in Mississippi. https://t.co/R5BDZ7WuEX,Tue Nov 27 18:15:08 +0000 2018,0.0,0.0,1.0,0.0
390,The New York Times,"At his heaviest, Michael Warner weighed 696 pounds. But after learning he was prediabetic, he felt motivated to mak… https://t.co/a5ds7WGe0c",Tue Nov 27 18:00:06 +0000 2018,0.4588,0.136,0.864,0.0
391,The New York Times,A father was found shot to death outside his home. His wife and 2 young children were found dead inside their burni… https://t.co/KPth7NRPCP,Tue Nov 27 17:45:07 +0000 2018,-0.8481,0.0,0.699,0.301
392,The New York Times,American and Czech forces are under investigation for the death of an Afghan commando who was beaten while in NATO… https://t.co/B5qnv43zDz,Tue Nov 27 17:37:04 +0000 2018,-0.7717,0.0,0.739,0.261
393,The New York Times,RT @migold: A family of 4 brutally killed before Thanksgiving. Suspicious fires in homes owned by 2 brothers. And a whole lot of questions.…,Tue Nov 27 17:30:12 +0000 2018,-0.9001,0.0,0.607,0.393
394,The New York Times,"A former schoolteacher and his twin brother pleaded guilty to federal conspiracy and bomb-making charges, admitting… https://t.co/90LFa6jxnJ",Tue Nov 27 17:15:10 +0000 2018,-0.8074,0.0,0.61,0.39
395,The New York Times,"In Opinion

Dana Bolger writes, ""Our educations shouldn’t depend on whether we live in a school district that cares… https://t.co/NONsZdnWvo",Tue Nov 27 17:00:14 +0000 2018,0.0,0.0,1.0,0.0
396,The New York Times,RT @mannyNYT: This 1997 case shows what can go wrong when troops patrol the border. A Marine shot and killed a Texas teenager herding goats…,Tue Nov 27 16:46:05 +0000 2018,-0.8225,0.0,0.734,0.266
397,The New York Times,"Even if the world cuts greenhouse gas emissions quickly, the United States will need to spend billions of dollars t… https://t.co/gBYev8pEwP",Tue Nov 27 16:30:12 +0000 2018,0.1531,0.117,0.792,0.092
398,The New York Times,"RT @marclacey: “I’m tired. Tired from this terminal, lonely as a sparrow in the rain,” he wrote. “Tired of never having a soul to be with o…",Tue Nov 27 16:14:04 +0000 2018,-0.8074,0.0,0.726,0.274
399,The New York Times,"After 3 decades of balancing freedom and authoritarianism, is China leaning too far toward state control under Xi J… https://t.co/Iyg2ymmH1Z",Tue Nov 27 16:00:16 +0000 2018,0.6369,0.189,0.811,0.0
400,Fox News,.@POTUS: “Hopefully we can all work together next year to continue delivering for the American people.”… https://t.co/FdLczQZN4g,Thu Nov 08 05:01:00 +0000 2018,0.0,0.0,1.0,0.0
