,tweet_source,tweet_text,tweet_date,tweet_vader_score,tweet_pos_score,tweet_neu_score,tweet_neg_score
136,CNN,Beto-mania doesn't do justice to women | By Jill Filipovic for @CNNOpinion https://t.co/VA7S1ASPrE https://t.co/0AQrgC09gJ,Wed Nov 28 02:58:03 +0000 2018,-0.4168,0.0,0.812,0.188
137,CNN,Will Ferrell and John C. Reilly have an important message about facial hair https://t.co/SBzkWmqnuY https://t.co/5tkWSrLmn3,Wed Nov 28 02:46:03 +0000 2018,0.2023,0.114,0.886,0.0
138,CNN,Louisiana is trying to keep medical marijuana medical. It's harder than it sounds https://t.co/P6018SqQv6 https://t.co/GmUVoV2LIu,Wed Nov 28 02:43:51 +0000 2018,0.0,0.0,1.0,0.0
139,CNN,"Jack Ma, China's most famous entrepreneur, was identified as a member of the Communist Party https://t.co/DtqbJXB1Ac https://t.co/CuVrpbnuCi",Wed Nov 28 02:34:06 +0000 2018,0.4019,0.153,0.847,0.0
140,BBC News (World),"Lion Air crash: Airline should improve safety culture, a report says https://t.co/in1nUzrAVd",Wed Nov 28 03:35:16 +0000 2018,0.4588,0.348,0.488,0.165
141,BBC News (World),Sydney storms: Hundreds call for help amid flash-flooding https://t.co/3gsOXgy6sL,Wed Nov 28 01:41:36 +0000 2018,0.4019,0.252,0.748,0.0
142,BBC News (World),Ukraine-Russia sea clash: Trump says may cancel G20 Putin talks https://t.co/2TKQrAOB4q,Wed Nov 28 01:09:42 +0000 2018,-0.25,0.0,0.833,0.167
143,BBC News (World),John Allen Chau: Do missionaries help or harm? https://t.co/lnzFRE9cHM,Wed Nov 28 00:21:03 +0000 2018,-0.2023,0.205,0.53,0.265
144,BBC News (World),Why Brexit could threaten Dutch fishing industry https://t.co/iL3OPqFSn3,Wed Nov 28 00:12:12 +0000 2018,-0.3818,0.0,0.729,0.271
145,BBC News (World),US sanctions Nicaragua's Vice-President Rosario Murillo https://t.co/5vvNk0Hbal,Wed Nov 28 00:00:29 +0000 2018,0.0,0.0,1.0,0.0
146,BBC News (World),"Husky returns home after remarkable 2,200-mile adventure https://t.co/jMRvXZVRzS",Tue Nov 27 22:45:42 +0000 2018,0.7096,0.496,0.504,0.0
147,BBC News (World),The fight over the right to name Australian places https://t.co/vZ27E5DUVO,Tue Nov 27 22:41:04 +0000 2018,-0.3818,0.0,0.776,0.224
148,BBC News (World),Trump loves the army. Do they love him back? https://t.co/Mhbj7h8pEO,Tue Nov 27 22:15:52 +0000 2018,0.836,0.497,0.503,0.0
149,BBC News (World),Nato state appoints first female head of armed forces https://t.co/rdaVoQHucG,Tue Nov 27 22:01:24 +0000 2018,0.0,0.0,1.0,0.0
150,BBC News (World),RT @bbcweather: Strong chance of a new El Niño forming by early 2019 https://t.co/h7ZaKRgLuT,Tue Nov 27 21:44:48 +0000 2018,0.6486,0.325,0.675,0.0
151,BBC News (World),US judge delays ruling on 'interesting' Julian Assange case https://t.co/qvOCg42GDR,Tue Nov 27 21:04:25 +0000 2018,0.0,0.0,1.0,0.0
152,BBC News (World),John Magufuli: Tanzania prefers 'condition-free' Chinese aid https://t.co/JhgbLg9nEo,Tue Nov 27 19:06:54 +0000 2018,0.0,0.0,1.0,0.0
153,BBC News (World),Alejandro Andrade: Venezuela ex-treasurer jailed over $1bn bribes https://t.co/2RgCsUvuqK,Tue Nov 27 18:54:13 +0000 2018,-0.4939,0.0,0.714,0.286
154,BBC News (World),Fehmida Riaz: Pakistan poet who dared to talk about female desire https://t.co/fDpJnotDVa,Tue Nov 27 18:33:04 +0000 2018,0.4019,0.197,0.803,0.0
155,BBC News (World),"""I'll never forget their cries, the way they watched me as I sat with them in the water""

https://t.co/3g4l6DUv1K",Tue Nov 27 17:20:07 +0000 2018,0.4449,0.197,0.803,0.0
156,BBC News (World),Mississippi's ugly past casts long shadow on Senate election https://t.co/wyl0np9TuC,Tue Nov 27 17:14:49 +0000 2018,-0.5106,0.0,0.732,0.268
157,BBC News (World),RT @BBCNorthAmerica: The BBC is launching a weekly news show on @FacebookWatch in the US that premieres this Thursday at 5pm est. Follow &amp;…,Tue Nov 27 17:12:07 +0000 2018,0.0,0.0,1.0,0.0
158,BBC News (World),Borussia Dortmund bus attack: Sergei Wenergold jailed https://t.co/F7GI7TVZBR,Tue Nov 27 16:32:48 +0000 2018,-0.743,0.0,0.488,0.512
159,BBC News (World),"🎄🎄🎄 The White House looks tree-mendous 🎄🎄🎄

[Tap to expand] https://t.co/n4x8hQu4RS https://t.co/Q3YQ1wZKTN",Tue Nov 27 16:17:23 +0000 2018,0.0,0.0,1.0,0.0
160,CBS News,"Anthem among health insurers refusing to pay ER bills, doctors say https://t.co/BGrAOUBvT7 https://t.co/DyskCJGCO8",Wed Nov 28 04:48:04 +0000 2018,-0.4767,0.0,0.728,0.272
161,CBS News,Utah teacher kills her ex-husband's girlfriend in front of her kids https://t.co/8PS1Ot56DF https://t.co/DroatfMWkL,Wed Nov 28 04:33:05 +0000 2018,-0.5423,0.0,0.774,0.226
162,CBS News,Cindy Hyde-Smith’s Senate runoff win marks the “official end” of the 2018 midterm elections. https://t.co/lyHm1wyUFr https://t.co/E0YDEI1Rln,Wed Nov 28 04:21:33 +0000 2018,0.5859,0.202,0.798,0.0
163,CBS News,"RT @edokeefe: HISTORY: With @CindyHydeSmith’s win in the Mississippi runoff election, 24 women will serve in the U.S. Senate — a new record…",Wed Nov 28 04:18:58 +0000 2018,0.5859,0.16,0.84,0.0
164,CBS News,"“When this became the year of the woman...it was very much the year of the Democratic woman. So, to have these wins… https://t.co/wSpriNRkav",Wed Nov 28 04:09:58 +0000 2018,0.0,0.0,1.0,0.0
165,CBS News,"“I want everybody to know, no matter who you voted for today, I’m gonna always represent every Mississippian,” says… https://t.co/mIMZbUAYvb",Wed Nov 28 04:02:37 +0000 2018,-0.2023,0.111,0.787,0.102
166,CBS News,"“Being on that MAGA-wagon, the Make American Great Again bus, we have bonded, we have persevered, we have gotten th… https://t.co/ryJQpsft8U",Wed Nov 28 03:57:49 +0000 2018,0.6249,0.17,0.83,0.0
167,CBS News,HAPPENING NOW: Cindy Hyde-Smith addresses supporters after winning Mississippi Senate runoff election.… https://t.co/9CRtaUZ7mY,Wed Nov 28 03:52:47 +0000 2018,0.743,0.364,0.636,0.0
168,CBS News,"“She has my prayers as she goes to Washington to unite a very divided Mississippi,” says Mike Espy after his oppone… https://t.co/GXTAm1a5P0",Wed Nov 28 03:50:36 +0000 2018,0.0,0.0,1.0,0.0
169,CBS News,HAPPENING NOW: Democrat Mike Espy speaks after Republican Cindy Hyde-Smith wins Mississippi runoff.… https://t.co/FJvqTuggiN,Wed Nov 28 03:45:11 +0000 2018,0.5719,0.222,0.778,0.0
170,CBS News,"BREAKING: Republican Sen. Cindy Hyde-Smith wins Mississippi Senate runoff, becoming the first woman elected to Sena… https://t.co/br2dO3wGol",Wed Nov 28 03:32:45 +0000 2018,0.5719,0.188,0.812,0.0
171,CBS News,Accused Russian spy Maria Butina asks to be moved from solitary confinement https://t.co/0XseXnsOh2 https://t.co/b2zFIaRJmo,Wed Nov 28 03:30:01 +0000 2018,-0.296,0.0,0.855,0.145
172,CBS News,"Mississippi Senate race: With 62-percent of districts reporting, Republican Cindy Hyde-Smith is currently leading w… https://t.co/GY8ETC5NFM",Wed Nov 28 03:14:10 +0000 2018,0.0,0.0,1.0,0.0
173,CBS News,"Pres. Trump again rejects climate change report, lashes out at Federal Reserve https://t.co/5AEz1K0JPW https://t.co/0vn4pVU3Li",Wed Nov 28 02:49:53 +0000 2018,-0.4939,0.0,0.802,0.198
174,CBS News,"Officers ""violated public trust"" with cover stories in Laquan McDonald death, prosecutor says… https://t.co/vHZm4DeEh6",Wed Nov 28 02:30:00 +0000 2018,-0.6124,0.153,0.509,0.338
175,CBS News,"GM will save $4.5 billion by cutting 14,000 jobs and closing five factories. 

But according to SEC filings, the co… https://t.co/G56kFwiwas",Wed Nov 28 02:09:43 +0000 2018,0.4019,0.135,0.802,0.063
176,CBS News,This is what Pres. Trump's threat to close the U.S.-Mexico border would cost https://t.co/dL7S0i2P9l https://t.co/NdfNK52ohA,Wed Nov 28 01:49:59 +0000 2018,-0.5267,0.0,0.805,0.195
177,CBS News,"""Because of your support, I feel hopeful that our lives will return to normal"": Dr. Christine Blasey Ford released… https://t.co/dxk7vcIENL",Wed Nov 28 01:29:31 +0000 2018,0.7184,0.261,0.739,0.0
178,CBS News,Polls are now closed in the Mississippi Senate special election as Republican Sen. Cindy Hyde-Smith defends her sea… https://t.co/bJzFA30krk,Wed Nov 28 01:11:31 +0000 2018,0.4019,0.13,0.87,0.0
179,CBS News,Active shooter scare at Walter Reed National Military Medical Center was a drill gone wrong https://t.co/skK91p2pOg https://t.co/hIJJ9vUm9w,Wed Nov 28 00:41:01 +0000 2018,-0.5574,0.123,0.591,0.286
180,The New York Times,He couldn’t recall the last time he needed to wash bugs from his windshield. Where had all those insects gone?  And… https://t.co/c9SYsdZYAt,Wed Nov 28 04:47:06 +0000 2018,0.0,0.0,1.0,0.0
181,The New York Times,"The choreographer Rennie Harris on Alvin Ailey, whose company turns 60: “He’s still affecting folk: black, brown, w… https://t.co/pesCOCLFT8",Wed Nov 28 04:36:02 +0000 2018,0.0,0.0,1.0,0.0
182,The New York Times,"RT @alanfeuer: Today's testimony at the Chapo trial had it all: a $10 million beach house, a flight to Switzerland for a cellular rejuvenat…",Wed Nov 28 04:17:00 +0000 2018,0.0,0.0,1.0,0.0
183,The New York Times,"“Yes, it’s stressful. You work in an Ebola unit all day, then you go back to the hotel and hear gunfire at night.” https://t.co/wCXpUYgtsf",Wed Nov 28 04:02:02 +0000 2018,-0.5106,0.0,0.875,0.125
184,The New York Times,"RT @migold: Stephen Hillenburg's SpongeBob has been on TV more or less continuously since 1999. 

If you don't get SpongeBob, I explained w…",Wed Nov 28 03:53:03 +0000 2018,0.0,0.0,1.0,0.0
185,The New York Times,"A federal appeals court upheld most of the criminal convictions against two aides to Chris Christie in the 2013 ""Br… https://t.co/HxOrv9KNOo",Wed Nov 28 03:47:03 +0000 2018,-0.5667,0.0,0.838,0.162
186,The New York Times,See full results and maps from the Mississippi Senate election here: https://t.co/vXm6xaffkK,Wed Nov 28 03:38:00 +0000 2018,0.0,0.0,1.0,0.0
187,The New York Times,"Breaking News: In the year's final Senate race, Cindy Hyde-Smith retained her seat in Mississippi, strengthening th… https://t.co/JhZUsDFxtg",Wed Nov 28 03:30:49 +0000 2018,0.5106,0.212,0.788,0.0
188,The New York Times,"RT @alanblinder: Breaking from Mississippi: Senator Cindy Hyde-Smith, the Republican candidate, has defeated Mike Espy, the Democratic cand…",Wed Nov 28 03:26:41 +0000 2018,-0.4767,0.0,0.846,0.154
189,The New York Times,"Mississippi Senate election live results
https://t.co/MyvDQqBg67",Wed Nov 28 03:17:01 +0000 2018,0.0,0.0,1.0,0.0
190,The New York Times,"Allies of Stacey Abrams, the Democrat who narrowly lost the Georgia governor’s race, filed a federal lawsuit callin… https://t.co/5RR5aTp7vW",Wed Nov 28 03:02:06 +0000 2018,-0.4939,0.0,0.792,0.208
191,The New York Times,"RT @nytpolitics: John Bolton, the national security adviser, said he had not listened to audio of the killing of Jamal Khashoggi because he…",Wed Nov 28 02:47:03 +0000 2018,-0.4588,0.086,0.755,0.158
192,The New York Times,Evening Briefing: Here's what you need to know at the end of the day https://t.co/0yJ14URQfb,Wed Nov 28 02:32:04 +0000 2018,0.0,0.0,1.0,0.0
193,The New York Times,"Mississippi Senate election live results
https://t.co/iD4MurukNa",Wed Nov 28 02:17:05 +0000 2018,0.0,0.0,1.0,0.0
194,The New York Times,RT @nytmike: NEW: Giuliani said Mueller's team hammered Manafort on whether Trump knew about the 2016 Trump Tower meeting. “He wants Manafo…,Wed Nov 28 02:02:03 +0000 2018,0.0,0.0,1.0,0.0
195,The New York Times,"Breaking News: President Trump’s lawyers are said to have been briefed on what Paul Manafort told investigators, in… https://t.co/u2qru0twi7",Wed Nov 28 01:51:22 +0000 2018,0.0,0.0,1.0,0.0
196,The New York Times,"Netflix announced it has acquired the rights to develop many of Roald Dahl’s most beloved children's books, includi… https://t.co/AdQdqcz50x",Wed Nov 28 01:47:02 +0000 2018,0.5563,0.166,0.834,0.0
197,The New York Times,RT @Nate_Cohn: The polls are closed in Mississippi. NYT results are live:  https://t.co/1D5dsisr5l,Wed Nov 28 01:33:04 +0000 2018,0.0,0.0,1.0,0.0
198,The New York Times,First election results are coming in from Mississippi. Follow the vote here. https://t.co/ZZxeIq0Kux,Wed Nov 28 01:26:03 +0000 2018,0.0,0.0,1.0,0.0
199,The New York Times,"RT @nytimesbooks: As tensions along the Mexican border remain high, here are 3 books that will help you understand the lives of those who l…",Wed Nov 28 01:15:09 +0000 2018,0.0,0.099,0.803,0.099
200,Fox News,"Las Vegas shooting survivors were inside Thousand Oaks bar, friends say https://t.co/nW9TLTON9n",Thu Nov 08 10:30:40 +0000 2018,0.4767,0.22,0.78,0.0
201,Fox News,"UPDATE: At least 11 wounded in shooting at California bar, gunman dead, police say https://t.co/awRowfbeRy",Thu Nov 08 10:24:08 +0000 2018,-0.6486,0.0,0.765,0.235
202,Fox News,Authorities confirm gunman is dead @FoxFriendsFirst https://t.co/PvITYr54AX https://t.co/a2EIH1EWmA,Thu Nov 08 10:16:43 +0000 2018,-0.6486,0.0,0.619,0.381
203,Fox News,Ventura County Sheriff’s Office Captain Garo Kuredjian: “I don’t know what the condition of any of the victims are… https://t.co/96mT27WHZv,Thu Nov 08 10:10:46 +0000 2018,-0.3182,0.0,0.892,0.108
204,Fox News,"At least 11 shot, including sheriff’s deputy — Jonathan Hunt has the latest from the scene of the California shooti… https://t.co/sLzLyMsrn5",Thu Nov 08 10:03:44 +0000 2018,0.0,0.0,1.0,0.0
205,Fox News,Witnesses describe chaotic scene during Thousand Oaks shooting https://t.co/qE8RqKGjz3,Thu Nov 08 09:54:50 +0000 2018,-0.4939,0.0,0.714,0.286
206,Fox News,UPDATE: At least 11 people hurt in California shooting @FoxFriendsFirst https://t.co/PvITYr54AX https://t.co/RGWIkaxF4f,Thu Nov 08 09:46:19 +0000 2018,-0.5267,0.0,0.764,0.236
207,Fox News,"Daniel Hoffman on California shooting: “This still an active shooter scene, and the focus is on dealing with that a… https://t.co/PiwHhe5HuX",Thu Nov 08 09:40:57 +0000 2018,0.4019,0.119,0.881,0.0
208,Fox News,"Former Las Vegas Metro Police Lt. Randy Sutton: “Those who respond to this show incredible bravery, because they ar… https://t.co/idcJJuVRMP",Thu Nov 08 09:31:36 +0000 2018,0.4939,0.144,0.856,0.0
209,Fox News,"Authorities deliver a briefing on a shooting in Thousand Oaks, California. (Courtesy: KCBS) https://t.co/5VGZz3rDIL",Thu Nov 08 09:25:02 +0000 2018,0.0,0.0,1.0,0.0
210,Fox News,"Mass shooting at California bar, @HeatherChilders &amp; @JackieibanezFNC have the latest @FoxFriendsFirst… https://t.co/8c8H5LUFCu",Thu Nov 08 09:18:00 +0000 2018,0.0,0.0,1.0,0.0
211,Fox News,Tesla names Robyn Denholm as Chairman to replace Elon Musk (via @FoxBusiness) https://t.co/SKjBXxUdOD,Thu Nov 08 09:10:00 +0000 2018,0.0,0.0,1.0,0.0
212,Fox News,@marcthiessen: “The president today made very clear that he wants to cut deals with the Democrats. And quite frankl… https://t.co/3eA2dn4vQh,Thu Nov 08 09:01:00 +0000 2018,0.2006,0.126,0.783,0.091
213,Fox News,".@TuckerCarlson: ""While everyone else obsessed over dossiers and FISA warrants, Sessions worried about the mission… https://t.co/LSvnOqZMsq",Thu Nov 08 09:00:00 +0000 2018,-0.4404,0.0,0.782,0.218
214,Fox News,"Wife's dying wish was for him to clean up bloody crime scene, suspect claims: reports https://t.co/7Wxd39jDEB",Thu Nov 08 08:51:00 +0000 2018,-0.4939,0.216,0.44,0.344
215,Fox News,DEVELOPING: Massive police response after reports of shooting at California nightclub https://t.co/awRowfsPJ6,Thu Nov 08 08:41:00 +0000 2018,0.0,0.0,1.0,0.0
216,Fox News,".@senatemajldr Mitch McConnell said Wednesday that Democrats and Republicans will have to address health care ""on a… https://t.co/XxmktKMZ7F",Thu Nov 08 08:31:00 +0000 2018,0.4939,0.158,0.842,0.0
217,Fox News,"Joseph diGenova on who could replace AG Sessions: ""@ChrisChristie would have the full confidence of @POTUS, which i… https://t.co/lt485btkXG",Thu Nov 08 08:21:00 +0000 2018,0.5106,0.155,0.845,0.0
218,Fox News,Dem @GavinNewsom's wild victory party in LA features controversial rapper @common https://t.co/V9SSpxOUH7,Thu Nov 08 08:06:00 +0000 2018,0.2263,0.186,0.69,0.124
219,Fox News,".@jasoninthehouse: “Attorney General @jeffsessions is a patriot. He was a good Republican, and I applaud him for hi… https://t.co/MRia8l8dOM",Thu Nov 08 08:01:00 +0000 2018,0.7096,0.296,0.704,0.0
220,CNN,"RT @CuomoPrimeTime: ""Manafort is already a known liar. That's part of what the probe showed about him...thats why he had a to make a plea d…",Wed Nov 28 02:32:02 +0000 2018,-0.5106,0.0,0.87,0.13
221,CNN,"Special counsel Robert Mueller's team asked Jerome Corsi about his interactions with Roger Stone surrounding the ""A… https://t.co/0CBs1SmIkh",Wed Nov 28 02:22:06 +0000 2018,0.4019,0.137,0.863,0.0
222,CNN,"Rep. Jerry Nadler, the likely incoming chairman of the House Judiciary Committee, warned President Trump that ""even… https://t.co/uUDaD6cpt7",Wed Nov 28 02:10:07 +0000 2018,-0.2732,0.0,0.89,0.11
223,CNN,The Department of Justice said that it plans to appeal a temporary restraining order issued last week that blocks t… https://t.co/j5qTXk752v,Wed Nov 28 01:58:05 +0000 2018,0.3612,0.146,0.773,0.082
224,CNN,"Trump administration climate change report is dead wrong, says Trump administration | Analysis by Chris Cillizza… https://t.co/ctp92p1vWl",Wed Nov 28 01:46:05 +0000 2018,-0.8126,0.0,0.654,0.346
225,CNN,A video released by the US Forest Service shows the moment when a gender reveal party in Arizona went horribly wron… https://t.co/CbCxkr6s0t,Wed Nov 28 01:34:00 +0000 2018,-0.1779,0.112,0.747,0.141
226,CNN,"An instructor forgot to harness this man onto a hang glider as it took off. He sustained a broken arm, but says he… https://t.co/lsIuBbU7gg",Wed Nov 28 01:22:00 +0000 2018,-0.2617,0.0,0.911,0.089
227,CNN,Congressional negotiators are currently debating a provision inside the long-delayed farm bill that could extend lu… https://t.co/Mf3CvE7pxq,Wed Nov 28 01:10:04 +0000 2018,0.1779,0.102,0.898,0.0
228,CNN,Members of the migrant caravan traveling through Mexico may have to wait up to six weeks at the US-Mexico border be… https://t.co/UY762lx4fv,Wed Nov 28 00:58:04 +0000 2018,0.0,0.0,1.0,0.0
229,CNN,"This is one farm animal you wouldn't want any beef with.

""Knickers,"" an enormous Holstein-Friesian steer in Austra… https://t.co/oyHec2eo5s",Wed Nov 28 00:46:00 +0000 2018,-0.0572,0.0,0.936,0.064
230,CNN,Papa John's shares sink after a report that a plan to sell the company has fallen apart https://t.co/eDseziGtbZ https://t.co/reYZOgJWnr,Wed Nov 28 00:34:06 +0000 2018,-0.0772,0.112,0.761,0.127
231,CNN,A video released by the US Forest Service shows the moment when a gender reveal party in Arizona went horribly wron… https://t.co/mmLagWpgVc,Wed Nov 28 00:22:06 +0000 2018,-0.1779,0.112,0.747,0.141
232,CNN,"Economic expansions never go on forever. As the United States' long, slow recovery from the Great Recession stretch… https://t.co/4BKnabWrHw",Wed Nov 28 00:10:04 +0000 2018,0.6249,0.268,0.623,0.109
233,CNN,US President Trump blamed the GM plant closures and recent stock market dips on the Fed in a Washington Post interv… https://t.co/iHr8TtmK00,Wed Nov 28 00:00:07 +0000 2018,-0.4767,0.0,0.866,0.134
234,CNN,The endangered dusky gopher frog is dealt a setback at Supreme Court https://t.co/SsDTiJ5uDY https://t.co/YNbJ2TWVXU,Tue Nov 27 23:54:02 +0000 2018,0.5574,0.231,0.769,0.0
235,CNN,Shrinking islands. Declining fisheries. West Nile virus. More wildfires. Here's how your part of the US will be aff… https://t.co/cZ32Ak5QCO,Tue Nov 27 23:42:06 +0000 2018,0.0,0.0,1.0,0.0
236,CNN,"Pilot falls asleep, overshoots island destination by 30 miles https://t.co/wyL0SyXuRD https://t.co/gSNxJIoVyX",Tue Nov 27 23:30:04 +0000 2018,0.0,0.0,1.0,0.0
237,CNN,"Journalist Wendy Fry, who reported from the border when US authorities deployed tear gas against migrants rushing t… https://t.co/N3kIBmutmG",Tue Nov 27 23:24:05 +0000 2018,0.0,0.0,1.0,0.0
238,CNN,"Is it now safe to eat romaine lettuce? Not yet, FDA says
https://t.co/K3AndM2IOe https://t.co/QW5syKkrDe",Tue Nov 27 23:10:05 +0000 2018,0.4404,0.182,0.818,0.0
239,CNN,"Journalist Wendy Fry, who reported from the border when US authorities deployed tear gas against migrants rushing t… https://t.co/aX693Wr9BW",Tue Nov 27 23:00:08 +0000 2018,0.0,0.0,1.0,0.0
240,BBC News (World),"RT @BBCPolitics: Theresa May: ""Now I've got to the final deal, everybody's saying ok, what's the next thing?"" 

PM describes ""frustration""…",Tue Nov 27 16:16:06 +0000 2018,0.296,0.099,0.901,0.0
241,BBC News (World),Ukraine-Russia sea clash: Who controls the territorial waters around Crimea? https://t.co/hVZj61qM9p,Tue Nov 27 16:04:34 +0000 2018,0.0,0.0,1.0,0.0
242,BBC News (World),"""Touchdown confirmed""

High-fives and special handshakes after @NASA successfully lands InSight robot on #Mars 

[T… https://t.co/lqmZn0CeWw",Tue Nov 27 15:56:08 +0000 2018,0.7096,0.296,0.704,0.0
243,BBC News (World),"Wandering peacocks a 'growing problem' on the Isle of Man, says ManxSPCA https://t.co/3UFW9JPLaZ",Tue Nov 27 15:45:37 +0000 2018,-0.25,0.118,0.694,0.188
244,BBC News (World),"A surge in cocaine deaths in the US is being blamed on fentanyl, a synthetic opioid far stronger than morphine

[Ta… https://t.co/i3FXgaKDR1",Tue Nov 27 15:39:56 +0000 2018,-0.128,0.11,0.759,0.131
245,BBC News (World),Cancer 'cure' boss David Noakes jailed for 15 months https://t.co/LMQ2pEQqmP,Tue Nov 27 15:08:45 +0000 2018,-0.8225,0.0,0.513,0.487
246,BBC News (World),"Fentanyl in cocaine: The deadly truth of new drugs cocktail

https://t.co/iP0M9Y3gZR https://t.co/mNYGsh1jCF",Tue Nov 27 14:58:07 +0000 2018,0.3182,0.173,0.827,0.0
247,BBC News (World),Afghanistan: US service members killed in bomb explosion https://t.co/KRfPhqo7Hg,Tue Nov 27 14:32:18 +0000 2018,-0.8271,0.0,0.476,0.524
248,BBC News (World),RT @BBCNews: Reality Check: Is Trump right about the #Brexit deal? https://t.co/wFWF6QMZeh,Tue Nov 27 14:17:38 +0000 2018,0.0,0.0,1.0,0.0
249,BBC News (World),After the caliphate: What next for IS? https://t.co/qoIy9Sb5hW,Tue Nov 27 14:13:58 +0000 2018,0.0,0.0,1.0,0.0
250,BBC News (World),"RT @BBCNews: Big Knickers, Australia's biggest steer, towers above the herd https://t.co/q2eERBgvpo",Tue Nov 27 13:44:17 +0000 2018,0.0,0.0,1.0,0.0
251,BBC News (World),"Big Knickers, Australia's biggest steer, towers above the herd https://t.co/o0LXJlR0dY",Tue Nov 27 12:56:04 +0000 2018,0.0,0.0,1.0,0.0
252,BBC News (World),Mo Salah: Egypt footballer weighs in on cats and dogs row https://t.co/jtDKvYLYJS,Tue Nov 27 12:51:35 +0000 2018,0.0,0.0,1.0,0.0
253,BBC News (World),Ukraine-Russia sea clash: Captured sailors shown on Russia TV https://t.co/drEzfAcSN0,Tue Nov 27 12:30:00 +0000 2018,0.0,0.0,1.0,0.0
254,BBC News (World),Swimmer abandons attempt to swim Pacific https://t.co/D39l6Kw5U7,Tue Nov 27 12:20:27 +0000 2018,-0.3182,0.0,0.723,0.277
255,BBC News (World),France fuel protests: Macron drives ahead amid unrest https://t.co/6jS76qBQhK,Tue Nov 27 12:19:10 +0000 2018,-0.2263,0.0,0.808,0.192
256,BBC News (World),Migrant caravan: Trump defends tear gas on Mexico border https://t.co/MyzdUiIB2J,Tue Nov 27 12:19:05 +0000 2018,0.0,0.0,1.0,0.0
257,BBC News (World),"RT @BBCPolitics: DUP leader Arlene Foster accuses Theresa May of ""giving up"" on a #Brexit deal that works for Northern Ireland, ahead of UK…",Tue Nov 27 12:17:35 +0000 2018,0.0,0.093,0.814,0.093
258,BBC News (World),"RT @BBCNews: ""He's a superman""

10-year-old Rupert, who had a rare blood disorder, is reunited with the man who helped save his life

[Tap…",Tue Nov 27 11:33:29 +0000 2018,0.128,0.124,0.772,0.104
259,BBC News (World),Honduran president's brother accused of drug trafficking https://t.co/3lxegyy5V5,Tue Nov 27 11:18:33 +0000 2018,-0.296,0.0,0.761,0.239
260,CBS News,"GM bought back $10 billion in stock since 2015, double what job cuts will save https://t.co/4D6KzwkPSt https://t.co/7z4i0HQSrO",Wed Nov 28 00:34:21 +0000 2018,0.25,0.157,0.735,0.108
261,CBS News,"RT @CBSThisMorning: She faced culinary challenges on #TopChef and #Chopped. Now, @cheffati is in a very different kind of fight.

Wednesday…",Wed Nov 28 00:25:52 +0000 2018,-0.3804,0.059,0.811,0.13
262,CBS News,"Senators to be briefed by Secretary of State Mike Pompeo and Defense Secretary James Mattis on Saudis, but want to… https://t.co/mxbtfWEL9s",Wed Nov 28 00:19:44 +0000 2018,0.1779,0.124,0.876,0.0
263,CBS News,"RT @CBSEveningNews: Mississippi will soon have either its first elected female senator, or its first black senator since Reconstruction.

S…",Tue Nov 27 23:55:29 +0000 2018,0.0,0.0,1.0,0.0
264,CBS News,"RT @CBSEveningNews: Pres. Trump threatened to end federal subsidies to GM on Tuesday, tweeting, “The U.S. saved General Motors, and this is…",Tue Nov 27 23:55:15 +0000 2018,-0.0516,0.109,0.775,0.116
265,CBS News,Three U.S. service members were killed by a roadside bomb in Afghanistan today. It is the largest loss of American… https://t.co/XeiWI4LGQ5,Tue Nov 27 23:51:20 +0000 2018,-0.875,0.0,0.63,0.37
266,CBS News,"RT @CBSEveningNews: A flight recorder on Lion Air Flight 610, which crashed last month off Indonesia, suggests pilots were locked in a dead…",Tue Nov 27 23:50:50 +0000 2018,0.0,0.0,1.0,0.0
267,CBS News,Paul Manafort is denying a report that he secretly met with Wikileaks founder Julian Assange about a trove of stole… https://t.co/vhyPKXkfr7,Tue Nov 27 23:44:16 +0000 2018,-0.34,0.0,0.882,0.118
268,CBS News,"""We're being told it is a drill. Have you heard that?""
""We were told it's not a drill""

@CBSDavidMartin shows the t… https://t.co/FQ0Kz56vq4",Tue Nov 27 23:37:19 +0000 2018,0.0,0.0,1.0,0.0
269,CBS News,"""What am I going to learn from it?"" National Security Advisor John Bolton revealed today that he hasn't listened to… https://t.co/xT6EA7yiaH",Tue Nov 27 23:30:12 +0000 2018,0.34,0.112,0.888,0.0
270,CBS News,Alzheimer's and dementia patients visited by puppies for Thanksgiving and receive a gift to help them feel loved al… https://t.co/Rq0jpYQ2VG,Tue Nov 27 23:29:47 +0000 2018,0.8591,0.373,0.627,0.0
